{
  "schema_version": "0.2.0",
  "observation_id": "obs_000002",
  "learner_ref": "learner_alice",
  "session_ref": "sess_20260815_0002",
  "activity_ref": "act_read_aloud_0017",
  "claim_ref": "dlc_fsi_german_a1:claim/pron_ich_laut",
  "material_snapshot_ref": {
    "id": "snap_000123",
    "version": "1.0.0",
    "sha256": "0123456789abcdef0123456789abcdef0123456789abcdef0123456789abcdef"
  },
  "evidence_group_id": "eg_20260815_0008",
  "assistance": {
    "hint_count": 0,
    "retry_count": 0,
    "answer_revealed": false,
    "assistance_level": "none"
  },
  "evaluator": {
    "id": "eval_gop_german",
    "version": "0.3.0",
    "kind": "model"
  },
  "observed_at": "2026-08-15T10:09:12+08:00",
  "result_kind": "abstention",
  "abstention_reason": "audio_quality_low"
}
